{
  "event_id": "01HXYZABCDEF0123456789ABD8",
  "schema_version": "1",
  "occurred_at": "2026-04-17T14:30:00.000Z",
  "session_id": "01HXYZABCDEF0123456789ABCE",
  "stream": "live",
  "tool": "claude-code",
  "model": "claude-opus-4-7",
  "kind": "tool_call",
  "context": { "platform": "linux" },
  "payload": {
    "tool_name": "Bash",
    "input": { "command": "cargo test" },
    "output": {
      "stdout": null,
      "stderr": null,
      "exit_code": 0,
      "truncated": true,
      "cas_ref": "sha256:a1b2c3d4e5f60718293a4b5c6d7e8f901a1b2c3d4e5f60718293a4b5c6d7e8f9",
      "size": 327680
    },
    "duration_ms": 54321,
    "outcome": "success"
  },
  "content_hash": "sha256:9999999999999999999999999999999999999999999999999999999999999999"
}
